{
  "schema_version": 1,
  "region_id": "primkrai",
  "dependency_lock": "pipeline/requirements-lock.txt",
  "inputs": [
    "METHOD_DENSITY.md",
    "SOURCES.md",
    "pipeline/audit_density.py",
    "pipeline/build_density.py",
    "pipeline/build_priority.py",
    "pipeline/extract_osm.py",
    "pipeline/population_sources.py",
    "pipeline/prepare_inputs.py",
    "pipeline/priority_config.json",
    "pipeline/run_reviewed.py",
    "pipeline/sensitivity.py",
    "pipeline/test_density.py",
    "sources/baseline/expansion_priority.geojson",
    "sources/baseline/federal_roads.geojson",
    "sources/baseline/major_roads.geojson",
    "sources/baseline/municipalities.geojson",
    "sources/baseline/settlement_density.geojson",
    "sources/baseline/settlements.geojson",
    "sources/baseline/stores.geojson",
    "sources/osm-cache/osm-boundaries.json",
    "sources/osm-cache/osm-buildings.geojson",
    "sources/osm-cache/osm-extraction.json",
    "sources/rosstat_municipal_population_2025.xlsx",
    "sources/rosstat_vpn2020_table5.xlsx",
    "INPUT_PROVENANCE.json",
    "sources/building-review.json",
    "pipeline/housing_register.py",
    "pipeline/test_housing_register.py",
    "review/housing-register.json",
    "pipeline/verify_local_setup.py",
    "pipeline/prepare_housing_queue.py",
    "pipeline/test_local_setup.py",
    "sources/legacy-snapshot-manifest.json",
    "sources/local-derived-manifest.json",
    "sources/osm-cache/housing-review-domains.geojson",
    "LOCAL_DATA_SETUP.md",
    "sources/legacy-snapshot/README.md",
    "sources/legacy-snapshot/build_manifest.json",
    "sources/legacy-snapshot/data/expansion_priority.geojson",
    "sources/legacy-snapshot/data/federal_roads.geojson",
    "sources/legacy-snapshot/data/major_roads.geojson",
    "sources/legacy-snapshot/data/municipalities.geojson",
    "sources/legacy-snapshot/data/settlement_density.geojson",
    "sources/legacy-snapshot/data/settlements.geojson",
    "sources/legacy-snapshot/data/stores.geojson",
    "sources/legacy-snapshot/pipeline/build_base_layers.py",
    "sources/legacy-snapshot/pipeline/build_manifest.json",
    "sources/legacy-snapshot/pipeline/inputs.lock.json",
    "sources/legacy-snapshot/pipeline/outputs/expansion_priority.geojson",
    "sources/legacy-snapshot/pipeline/outputs/federal_roads.geojson",
    "sources/legacy-snapshot/pipeline/outputs/major_roads.geojson",
    "sources/legacy-snapshot/pipeline/outputs/municipalities.geojson",
    "sources/legacy-snapshot/pipeline/outputs/settlement_density.geojson",
    "sources/legacy-snapshot/pipeline/outputs/settlements.geojson",
    "sources/legacy-snapshot/pipeline/outputs/stores.geojson",
    "sources/legacy-snapshot/pipeline/pipeline.json",
    "sources/legacy-snapshot/pipeline/priority_config.json",
    "sources/legacy-snapshot/pipeline/requirements-lock.txt",
    "sources/legacy-snapshot/pipeline/settlement_density_config.json",
    "sources/legacy-snapshot/pipeline/standard_layer.example.json",
    "sources/legacy-snapshot/region.json",
    "sources/legacy-snapshot/sources/cache/far-eastern-fed-district-latest.osm.pbf",
    "sources/legacy-snapshot/sources/pyaterochka_5dfo_snapshot.html",
    "sources/legacy-snapshot/sources/rosstat_municipal_population_2025.xlsx",
    "sources/legacy-snapshot/sources/rosstat_vpn2020_table5.xlsx"
  ],
  "outputs": [
    "pipeline/outputs/municipalities.geojson",
    "pipeline/outputs/settlements.geojson",
    "pipeline/outputs/stores.geojson",
    "pipeline/outputs/expansion_priority.geojson",
    "pipeline/outputs/major_roads.geojson",
    "pipeline/outputs/federal_roads.geojson",
    "pipeline/outputs/settlement_density.geojson",
    "pipeline/outputs/settlement_density_unverified.geojson",
    "pipeline/outputs/housing_review.geojson"
  ],
  "steps": [
    {
      "name": "reconcile controls, rebuild and independently audit Primorye density",
      "command": [
        "{python}",
        "pipeline/run_reviewed.py"
      ]
    }
  ]
}
